,word,pronounciation,definition,part of speech,sentence_1_kanji,sentence_1_hiragana,sentence_1_english
4468,委員会,いいんかい,committee,Noun,明日、委員会が開かれます。,あした、いいんかい が ひらかれます。,The committee meeting will be held tomorrow.
4469,デモ,,demonstration,Verbal Noun,彼女はデモに参加したよ。,かのじょ は デモ に さんか した よ。,She participated in the demonstration.
4470,一般に,いっぱんに,"generally, in general",Adverb,一般にお年寄りは早起きです。,いっぱん に おとしより は はやおき です。,"Generally, elderly people are early risers."
4471,一斉に,いっせいに,"all together, all at once",Adverb,彼らは一斉に拍手したね。,かれら は いっせい に はくしゅ した ね。,They applauded all at once.
4472,典型的,てんけいてき,typical,Adjectival Noun,彼女は典型的なイタリア人です。,かのじょ は てんけいてきな イタリア じん です。,She's a typical Italian.
4473,住宅地,じゅうたくち,residential district,Noun,その住宅地は便利な場所にあるね。,その じゅうたく ち は べんりな ばしょ に ある ね。,The residential district is conveniently located.
4474,出版社,しゅっぱんしゃ,"publishing company, publisher",Noun,彼女は出版社で働いています。,かのじょ は しゅっぱん しゃ で はたらいて います。,She works for a publisher.
4475,ため息,ためいき,sigh,Noun,母はため息をついたの。,はは は ためいき を ついた の。,My mother sighed.
4476,電卓,でんたく,calculator,Noun,この電卓はポケットに入ります。,この でんたく は ポケット に はいります。,This calculator fits in your pocket.
4477,めいめい,,"each, individually",Adverb,交通費はめいめい支払ってください。,こうつう ひ は めいめい しはらって ください。,Please pay the fare individually.
4478,原稿用紙,げんこうようし,manuscript paper,Noun,作文を書くのに原稿用紙を使ったの。,さくぶん を かく の に げんこう ようし を つかった の。,I used manuscript paper to write my essay.
4479,貴重品,きちょうひん,valuables,Noun,貴重品は自分で持っていてください。,きちょう ひん は じぶん で もって いて ください。,Please take your valuables with you.
4480,弱み,よわみ,"weakness, disadvantage",Noun,彼は私の弱みを握っているんだ。,かれ は わたし の よわみ を にぎって いる んだ。,He has some dirt on me.
4481,硬さ,かたさ,hardness,Noun,理科の時間に石の硬さを比べたよ。,りか の じかん に いし の かたさ を くらべた よ。,"In our science class, we compared the hardness of stones."
4482,ちぎれる,,"be torn off, come off",Verb,荷物が重くて手がちぎれそうだ。,にもつ が おもくて て が ちぎれ そうだ。,It feels as though my arm could tear off because my luggage is so heavy.
4483,ぶら下げる,ぶらさげる,hang (something) down,Verb,彼は首にカメラをぶら下げているね。,かれ は くび に カメラを ぶらさげて いる ね。,He has a camera hanging around his neck.
4484,新学期,しんがっき,"new term, new semester",Noun,今日から新学期が始まります。,きょう から しん がっき が はじまります。,The new semester starts today.
4485,打ち合わせる,うちあわせる,"arrange, discuss",Verb,来週の予定を打ち合わせましょう。,らいしゅう の よてい を うちあわせましょう。,Let's discuss next week's schedule.
4486,奇数,きすう,odd number,Noun,3は奇数です。,3 は きすう です。,3 is an odd number.
4487,お坊さん,おぼうさん,"monk, priest",Noun,お寺からお坊さんが出てきましたよ。,おてら から おぼうさん が でて きました よ。,A monk came out of the temple.
4488,植物園,しょくぶつえん,botanical garden,Noun,植物園には珍しい花がたくさんありますね。,しょくぶつえん に は めずらしい はな が たくさん あります ね。,There are a lot of rare flowers in the botanical garden.
4489,ほこり,,dust,Noun,この部屋はほこりだらけですね。,この へや は ほこり だらけ です ね。,This room is covered with dust.
4490,割り引き,わりびき,"discount, lower estimate",Verbal Noun,今日は全品10%割り引きです。,きょう は ぜんぴん 10% わりびき です。,All goods are 10% off today.
4491,洗面器,せんめんき,wash bowl,Noun,洗面器でハンカチを洗ったの。,せんめんき で ハンカチ を あらった の。,I washed my handkerchief in a washbowl.
4492,根拠,こんきょ,"grounds, basis",Noun,何を根拠にそんなことを言うのですか。,なに を こんきょ に そんな こと を いう の です か。,On what grounds do you say such a thing?
4493,保つ,たもつ,"preserve, retain",Verb,彼女は若さを保とうと必死だ。,かのじょ は わかさ を たもとう と ひっし だ。,She's desperately trying to retain her youth.
4494,ガイド,,guide,Verbal Noun,ガイド付きの旅行を申し込んだの。,ガイド つき の りょこう を もうしこんだ の。,I signed up for a guided tour.
4495,航空券,こうくうけん,airline ticket,Noun,電話で航空券を予約しました。,でんわ で こうくうけん を よやく しました。,I booked an airline ticket by phone.
4496,栓抜き,せんぬき,bottle opener,Noun,栓抜きはどこですか。,せん ぬき は どこ です か。,Where's the bottle opener?
4497,とがる,,be sharp,Verb,この鉛筆はとがっていますね。,この えんぴつ は とがって います ね。,This pencil is sharp.
4498,臭う,におう,stink (unpleasant),Verb,流しが臭うのできれいにしたよ。,ながし が におう ので きれい に した よ。,I cleaned the sink because it stank.
4499,のんき,,"carefree, happy-go-lucky",Adjectival Noun,彼はずいぶんのんきなやつだ。,かれ は ずいぶん のんきな やつ だ。,He's a very happy-go-lucky guy.
4500,はしご,,ladder,Noun,はしごを使って屋根に上りました。,はしご を つかって やね に のぼりました。,I went up to the roof on a ladder.
4501,引っ掛ける,ひっかける,hook (something) on,Verb,その選手はハードルに足を引っ掛けたんだ。,その せんしゅ は ハードル に あし を ひっかけた ん だ。,The athlete caught his foot on the hurdle.
4502,麓,ふもと,foot of the mountain,Noun,彼は山の麓に住んでいるよ。,かれ は やま の ふもと に すんで いる よ。,He lives at the foot of a mountain.
4503,ほうき,,broom,Noun,ほうきで庭を掃除しました。,ほうき で にわ を そうじ しました。,I cleaned up the yard with a broom.
4504,微笑む,ほほえむ,smile,Verb,彼女は私に微笑んだよ。,かのじょ は わたし に ほほえんだ よ。,She smiled at me.
4505,真似,まね,"imitation, mimicry",Verbal Noun,娘はよく私の真似をします。,むすめ は よく わたし の まね を します。,My daughter often mimicks me.
4506,儲かる,もうかる,"be profitable, pay its way",Verb,彼の商売は儲かっているらしいね。,かれ の しょうばい は もうかって いる らしい ね。,His business seems profitable.
4507,レクリエーション,,recreation,Noun,町内会のレクリエーションに参加したの。,ちょうない かい の レクリエーション に さんか した の。,I took part in the recreational activities organized by the neighborhood association.
4508,ろうそく,,candle,Noun,バースデーケーキにろうそくを立てました。,バースデー ケーキ に ろうそく を たてました。,We put candles on the birthday cake.
4509,生き生きと,いきいきと,"lively, vigorously",Adverb,子供たちが生き生きと遊んでいるね。,こども たち が いきいき と あそんで いる ね。,The kids are playing with full spirit.
4510,速達便,そくたつびん,"special delivery mail, express mail",Noun,速達便なら明日の午前中に届きます。,そくたつ びん なら あした の ごぜん ちゅう に とどきます。,It will arrive tomorrow morning if you send it by express mail.
4511,必死に,ひっしに,desperately,Adverb,必死に単語を暗記したよ。,ひっし に たんご を あんき した よ。,I struggled to memorize the words.
4512,上がる,あがる,"eat, drink (honorific)",Verb,冷めないうちにどうぞお上がりください。,さめない うち に どうぞ おあがり ください。,Please eat it while it's still hot.
4513,荒い,あらい,"harsh, rough",Adjective,うちの犬は気が荒い。,うち の いぬ は き が あらい。,Our dog is bad-tempered.
4514,注ぐ,そそぐ,pour into (liquid),Verb,みんなのグラスにジュースを注いだよ。,みんな の グラス に ジュース を そそいだ よ。,I poured juice into everyone's glass.
4515,流行,りゅうこう,"fashion, trend",Verbal Noun,このスタイルは今年の流行です。,この スタイル は ことし の りゅうこう です。,This style is in fashion this year.
4516,額,ひたい,forehead,Noun,額に汗をかいたよ。,ひたい に あせ を かいた よ。,My forehead is covered in sweat.
4517,一種,いっしゅ,"sort of, almost",Adverb,これは一種独特の味がするね。,これ は いっしゅ どくとく の あじ が する ね。,This has an unusual sort of taste.
4518,抱く,だく,"hug, hold",Verb,祖母がうちの猫を抱いているわよ。,そぼ が うち の ねこ を だいて いる わ よ。,Grandma is holding our cat.
4519,柄,がら,"pattern, print",Noun,彼は犬の柄のTシャツを着ているよ。,かれ は いぬ の がら の ティーシャツ を きて いる よ。,He's wearing a T-shirt with a dog print on it.
4520,上,じょう,"upper, superior",Noun,握り寿司の上を注文したよ。,にぎりずし の じょう を ちゅうもん した よ。,I ordered the higher-priced sushi.
4521,下,げ,"lower, bottom",Noun,彼女の成績は上の下です。,かのじょ の せいせき は じょう の げ です。,Her grades are ranked at the bottom of the top group.
4522,盆,ぼん,tray,Noun,母が料理をお盆に乗せたの。,はは が りょうり を おぼん に のせた の。,My mother put the dishes on a tray.
4523,逆さま,さかさま,"upside-down, reverse",Adjectival Noun,それじゃあ上と下が逆さまだよ。,それじゃあ うえ と した が さかさま だ よ。,You need to turn it upside down.
4524,割合に,わりあいに,"relatively, rather",Adverb,今回のテストは割合に簡単でした。,こんかい の テスト は わりあい に かんたん でした。,The test was relatively easy this time.
4525,次々に,つぎつぎに,"one after another, in succession",Adverb,走者が次々 にゴールしました。,そうしゃ が つぎつぎ に ゴール しました。,The runners reached the goal one after another.
4526,罰する,ばっする,"punish, penalize",Verb,彼は違法駐車で罰せられたんだ。,かれ は いほう ちゅうしゃ で ばっせられた ん だ。,He was penalized for illegal parking.
4527,清書,せいしょ,"clean copy, final copy",Verbal Noun,この手紙を清書してください。,この てがみ を せいしょ して ください。,Please write a final copy of this letter.
4528,交わる,まじわる,"mingle, socialize",Verb,人と交わって、多くのことを学びました。,ひと と まじわって、おおく の こと を まなびました。,I learned a lot of things by socializing with other people.
4529,受け取り,うけとり,receipt,Noun,受け取りに判こをお願いします。,うけとり に はんこ を おねがいします。,Please stamp your seal on the receipt.
4530,にわかに,,"rapidly, at once",Adverb,空がにわかに暗くなったな。,そら が にわか に くらく なった な。,The sky got dark at once.
4531,年月,としつき,"time, years",Noun,あれから長い年月が経ちました。,あれ から ながい としつき が たちました。,It's been a long time since then.
4532,都,みやこ,"capital, city",Noun,ミラノはファッションの都です。,ミラノ は ファッション の みやこ です。,Milan is the capital of fashion.
4533,方々,ほうぼう,"all directions, everywhere",Noun,彼の連絡先を方々に問い合わせたんだ。,かれ の れんらく さき を ほうぼう に といあわせた ん だ。,I inquired everywhere for his contact information.
4534,陸,りく,"land, shore",Noun,ウミガメが陸に上がってきたんだ。,ウミガメ が りく に あがって きた ん だ。,The sea turtles came up to the land.
4535,能,のう,"ability, capability",Noun,彼は勉強するしか能のない人間だね。,かれ は べんきょう する しか のう の ない にんげん だ ね。,He's a kind of person who can do nothing but study.
4536,固体,こたい,"solid, solid matter",Noun,氷は固体です。,こおり は こたい です。,Ice is a solid.
4537,半面,はんめん,"half, one side",Noun,テニスコートの半面を使って試合をしたの。,テニス コート の はんめん を つかって しあい を した の。,We played tennis using one half of the court.
4538,家主,やぬし,owner of a rented house,Noun,家主は1階に住んでいます。,やぬし は 1 かい に すんで います。,The owner of this rented house lives on the first floor.
4539,著す,あらわす,write (a book),Verb,この本では自然の大切さがよく著されているよ。,この ほん で は しぜん の たいせつさ が よく あらわされて いる よ。,The importance of nature is well written in this book.
4540,乗り越し,のりこし,riding past one's stop,Verbal Noun,乗り越しを機械で精算したの。,のりこし を きかい で せいさん した の。,I paid the excess fare at the machine.
4541,日の入り,ひのいり,sunset,Noun,今日の日の入りは午後6時でした。,きょう の ひのいり は ごご 6 じ でした。,The sun set at 6 p.m. today.
4542,単数,たんすう,singular,Noun,penは単数でpensは複数です。,pen は たんすう で pens は ふくすう です。,"""Pen"" is the singular and ""pens"" is the plural."
4543,エチケット,,etiquette (loan word),Noun,エチケットを守ることは大切です。,エチケット を まもる こと は たいせつ です。,It's important to keep the rules of etiquette.
4544,大層,たいそう,"greatly, exceedingly",Adverb,彼は大層喜んでいました。,かれ は たいそう よろこんで いました。,He was greatly pleased.
4545,腰掛け,こしかけ,"stool, seat (literary)",Noun,腰掛けはありませんか。,こしかけ は ありません か。,Do you have a stool?
4546,客間,きゃくま,guest room,Noun,お客さんを客間にお通ししたわよ。,おきゃくさん を きゃくま に おとおしした わ よ。,I showed the guest into the reception room.
4547,仮名遣い,かなづかい,"kana orthography, use of kana",Noun,祖父は古い仮名遣いで書くことがあるの。,そふ は ふるい かなづかい で かく こと が ある の。,My grandfather sometimes uses the old kana orthography in writing.
4548,温帯,おんたい,temperate zone,Noun,日本は温帯にあります。,にっぽん は おんたい に あります。,Japan is located in the temperate zone.
4549,小数,しょうすう,decimal,Noun,小数は切り捨てて計算してください。,しょうすう は きりすてて けいさん して ください。,Please truncate the decimal when you calculate.
4550,熱する,ねっする,heat (something),Verb,鉄は熱すると曲がるんだ。,てつ は ねっする と まがる ん だ。,Iron bends when heated.
4551,腰掛ける,こしかける,sit down (literary),Verb,私はベンチに腰掛けたの。,わたし は ベンチ に こしかけた の。,I sat down on the bench.
4552,盆地,ぼんち,basin,Noun,盆地は夏、とても暑いんだ。,ぼんち は なつ、とても あつい ん だ。,It's very hot in the basin during summer.
4553,並木,なみき,row (line) of trees,Noun,駅前の並木が台風で倒れたらしい。,えき まえ の なみき が たいふう で たおれた らしい。,I heard that the line of trees in front of the station fell over in the typhoon.
4554,材木,ざいもく,"timber, wood",Noun,船から材木が降ろされていますね。,ふね から ざいもく が おろされて います ね。,Timber is being unloaded from the ship.
4555,元日,がんじつ,New Year's Day,Noun,元日には初詣に行きます。,がんじつ に は はつもうで に いきます。,I pay my first visit of the year to a shrine on New Year's Day.
4556,たく,,make (a fire),Verb,薪を集めて火をたいたよ。,まき を あつめて ひ を たいた よ。,I gathered wood and made a fire.
4557,照る,てる,"shine, blaze",Verb,日差しが強く照りつけますね。,ひざし が つよく てりつけます ね。,The sun is blazing strongly.
4558,気体,きたい,"gaseous body, gas",Noun,水が沸騰して気体になったんだ。,みず が ふっとう して きたい に なった ん だ。,The water boiled and turned into a gaseous body.
4559,和英,わえい,Japanese-English,Noun,私は和英辞書をよく使います。,わたし は わえい じしょ を よく つかいます。,I often use a Japanese-English dictionary.
4560,支援,しえん,"support, backing",Verbal Noun,彼の支援がなかったらどうなっていたか。,かれ の しえん が なかったら どう なって いた か。,What would have happened without his support?
4561,思い,おもい,"thoughts, feelings",Noun,必死の思いで彼に頼んだよ。,ひっし の おもい で かれ に たのんだ よ。,I desperately asked him for help.
4562,日々,ひび,"daily, every day",Noun,日々の努力が大切です。,ひび の どりょく が たいせつ です。,It's important to make day-to-day efforts.
4563,せい,,"cause, blame",Noun,自分の失敗を他人のせいにするな。,じぶん の しっぱい を たにん の せい に する な。,Don't blame others for your mistake.
4564,距離,きょり,distance,Noun,彼らは長い距離を歩き続けたんだ。,かれら は ながい きょり を あるき つづけた ん だ。,They kept walking a long distance.
4565,仕組み,しくみ,"construction, mechanism",Noun,この機械の仕組みは複雑だ。,この きかい の しくみ は ふくざつ だ。,The mechanism of this machine is complex.
4566,お前,おまえ,you (vulgar language),Noun,お前の言うことは信じられない。,おまえ の いう こと は しんじられない。,I can't believe what you say.
4567,男女,だんじょ,men and women,Noun,そのスポーツは男女一緒にします。,その スポーツ は だんじょ いっしょ に します。,Men and women play that sport together.
4568,役立つ,やくだつ,"be of use, come in handy",Verb,学校で勉強したことが役立った。,がっこう で べんきょう した こと が やくだった。,What I learned at school turned out to be useful.
4569,ロック,,rock (music),Noun,俺はロックを聞くのが好きだ。,おれ は ロック を きく の が すき だ。,I like to listen to rock music.
4570,市内,しない,in the city,Noun,明日は市内を観光する予定です。,あした は しない を かんこう する よてい です。,I'm planning go sightseeing in the city tomorrow.
4571,我が家,わがや,one's home,Noun,ぜひ我が家に遊びに来てください。,ぜひ わがや に あそび に きて ください。,Please come and visit us at home.
4572,浮かぶ,うかぶ,float (on a surface),Verb,沖にボートが浮かんでいます。,おき に ボート が うかんで います。,The boat is floating off the coast.
4573,生み出す,うみだす,"generate, produce",Verb,彼は数々の名作を生み出した。,かれ は かずかず の めいさく を うみだした。,He produced a number of masterpieces.
4574,たった,,"only, merely",Adverb,財布の中にたった1000円しかないよ。,さいふ の なか に たった 1000 えん しか ない よ。,"I only have 1,000 yen in my wallet."
4575,キリスト,,Christ,Noun,キリストの母親の名前はマリアだ。,キリスト の ははおや の なまえ は マリア だ。,The name of Christ's mother is Maria.
4576,あえて,,"dare, boldly",Adverb,彼はあえて危険を冒したの。,かれ は あえて きけん を おかした の。,He dared to face danger.
4577,抑える,おさえる,"suppress, bring under control",Verb,彼は怒りを抑えていたの。,かれ は いかり を おさえて いた の。,He was suppressing his anger.
4578,見つめる,みつめる,"stare, gaze",Verb,彼はその絵をずっと見つめていたの。,かれ は その え を ずっと みつめて いた の。,He was staring at the painting for a long time.
4579,ハード,,hard,Adjectival Noun,最近、仕事がかなりハードです。,さいきん、しごと が かなり ハード です。,My work is pretty hard these days.
4580,幅広い,はばひろい,"wide, profound",Adjective,彼は幅広い知識を持っています。,かれ は はばひろい ちしき を もって います。,He has profound knowledge.
4581,つなぐ,,"connect (someone, something)",Verb,インターネットは世界の人々をつなぎますね。,インターネット は せかい の ひとびと を つなぎます ね。,The Internet connects people all around the world.
4582,申し込み,もうしこみ,"application, signing up",Noun,今日、スポーツジムの申し込みをしました。,きょう、スポーツジム の もうしこみ を しました。,I signed up for a sports gym today.
4583,向き,むき,"direction, turn",Noun,花瓶の向きを変えたの。,かびん の むき を かえた の。,I turned the vase around.
4584,持ち込む,もちこむ,"bring in, carry on",Verb,機内に荷物を持ち込んだの。,きない に にもつ を もちこんだ の。,I carried my luggage onto the plane.
4585,徹底的,てっていてき,thorough,Adjectival Noun,部屋の中を徹底的に探しました。,へや の なか を てっていてき に さがしました。,I searched inside the room thoroughly.
4586,前向き,まえむき,"facing forward, positive",Adjectival Noun,前向きに検討します。,まえむき に けんとう します。,We'll consider the matter positively.
4587,録画,ろくが,"videotaping, recording",Verbal Noun,好きな番組を録画したの。,すきな ばんぐみ を ろくが した の。,I recorded my favorite program.
4588,喫煙,きつえん,smoking,Verbal Noun,ここでは喫煙できません。,ここ で は きつえん できません。,Smoking is not permitted here.
4589,乗り越える,のりこえる,"overcome, get over",Verb,彼は悲しみを乗り越えて強く生きた。,かれ は かなしみ を のりこえて つよく いきた。,He overcame his sadness and carried on with his life determinedly.
4590,値上げ,ねあげ,"price hike, price increase",Verbal Noun,バス代が値上げされました。,バス だい が ねあげ されました。,Bus fares have been increased.
4591,まし,,"better, preferable",Adjectival Noun,これでもないよりましだ。,これ で も ない より まし だ。,Even this is better than nothing.
4592,なぜか,,for no reason,Adverb,今日はなぜか体がだるい。,きょう は なぜ か からだ が だるい。,For no reason I feel heavy today.
4593,欲,よく,"desire, greed",Noun,あまり欲を出しちゃだめだよ。,あまり よく を だしちゃ だめ だ よ。,Don't be too greedy.
4594,守備,しゅび,"defense, fielding",Verbal Noun,そのチームは守備が甘いね。,その チーム は しゅび が あまい ね。,The team's defense is weak.
4595,闘う,たたかう,"fight, battle",Verb,彼は病気と闘ったの。,かれ は びょうき と たたかった の。,He battled against his illness.
4596,引き受ける,ひきうける,"take on, accept",Verb,新しい仕事を引き受けたよ。,あたらしい しごと を ひきうけた よ。,I took on a new job.
4597,情けない,なさけない,"pathetic, pitiful",Adjective,こんなことも知らないとは情けない。,こんな こと も しらない と は なさけない。,It's pitiful that you don't even know something like this.
4598,年収,ねんしゅう,annual income,Noun,税金の額は年収によって変わります。,ぜいきん の がく は ねんしゅう に よって かわります。,The amount of tax depends on your annual income.
4599,のぞく,,"peep, look in",Verb,ドアの隙間から中をのぞいたんだ。,ドア の すきま から なか を のぞいた ん だ。,I peeped inside through a crack in the door.
4600,持ち主,もちぬし,owner,Noun,この自転車の持ち主は誰ですか。,この じてんしゃ の もちぬし は だれ です か。,Who's the owner of this bicycle?
4601,同級生,どうきゅうせい,classmate,Noun,私たちは同級生です。,わたし たち は どうきゅうせい です。,We're classmates.
