,word,pronounciation,definition,part of speech,sentence_1_kanji,sentence_1_hiragana,sentence_1_english
0,行く,いく,go,Verb,日曜日は図書館に行きます。,にちようび は としょかん に いきます。,I go to the library on Sundays.
1,見る,みる,"see, look at",Verb,私は絵を見るのが好きです。,わたし は え を みる の が すき です。,I like looking at pictures.
2,多い,おおい,"a lot of, many",Adjective,京都にはお寺が多い。,きょうと に は おてら が おおい。,There are a lot of temples in Kyoto.
3,家,うち,"home, household",Noun,家に遊びにきてください。,うち に あそび に きて ください。,Please come over to my home.
4,これ,,"this, this one",Pronoun,これをください。,これ を ください。,I'll have this please.
5,それ,,"that, that one",Pronoun,それはとてもいい話だ。,それ は とても いい はなし だ。,That's a really nice story.
6,私,わたし,I (general),Pronoun,私が行きましょう。,わたし が いきましょう。,I'll go.
7,仕事,しごと,"work, job",Verbal Noun,3月は仕事が忙しい。,3 がつ は しごと が いそがしい。,I'm busy at work in March.
8,いつ,,when,Interrogative,彼女はいつ来ますか。,かのじょ は いつ きます か。,When is she coming?
9,する,,"do, make",Verb,友達と一緒に宿題をした。,ともだち と いっしょ に しゅくだい を した。,I did my homework with my friend.
10,出る,でる,"go out, leave",Verb,今朝は早く家を出ました。,けさ は はやく いえ を でました。,I left the house early this morning.
11,使う,つかう,"use, make use of",Verb,このパソコンを使ってください。,この パソコン を つかって ください。,Please use this computer.
12,所,ところ,place,Noun,私は友達の所に泊まった。,わたし は ともだち の ところ に とまった。,I stayed at my friend's place for the night.
13,作る,つくる,"make, create",Verb,今、朝ご飯を作っています。,いま、あさ ごはん を つくって います。,I'm making breakfast now.
14,思う,おもう,think,Verb,私もそう思います。,わたし も そう おもいます。,"I think so, too."
15,持つ,もつ,"have, possess",Verb,私は車を持っています。,わたし は くるま を もって います。,I have a car.
16,買う,かう,buy,Verb,郵便局で切手を買いました。,ゆうびんきょく で きって を かいました。,I bought a stamp at the post office.
17,時間,じかん,"time, hour",Noun,今は時間がありません。,いま は じかん が ありません。,I don't have time now.
18,知る,しる,know,Verb,誰もその話を知らない。,だれ も その はなし を しらない。,No one knows that story.
19,同じ,おなじ,"same, identical",Adjectival Noun,彼の日本語のレベルは私と同じくらいだ。,かれ の にほん ご の レベル は わたし と おなじ くらい だ。,His Japanese level is about the same as mine.
20,今,いま,now,Adverb,彼は今、勉強しています。,かれ は いま、べんきょう して います。,He's studying now.
21,新しい,あたらしい,new,Adjective,彼の車は新しい。,かれ の くるま は あたらしい。,His car is new.
22,なる,,become,Verb,彼は医者になりました。,かれ は いしゃ に なりました。,He became a doctor.
23,まだ,,"(not) yet, still",Adverb,宿題はまだ終わっていません。,しゅくだい は まだ おわって いません。,I haven't finished my homework yet.
24,あと,,after,Noun,仕事のあと、映画を見た。,しごと の あと、 えいが を みた。,I saw a movie after work.
25,聞く,きく,"hear, ask, listen",Verb,彼女はラジオを聞いています。,かのじょ は ラジオ を きいて います。,She's listening to the radio.
26,言う,いう,"say, tell",Verb,上司が「一杯、飲もう」と言った。,じょうし が 「いっぱい のもう」 と いった。,"My boss said: ""Let's have a drink."""
27,少ない,すくない,"few, little",Adjective,今年は雨が少ないです。,ことし は あめ が すくない です。,There's not much rain this year.
28,高い,たかい,"high, tall",Adjective,これがこの町で一番高いビルです。,これ が この まち で いちばん たかい ビル です。,This is the tallest building in this town.
29,子供,こども,child,Noun,電車で子供が騒いでいた。,でんしゃ で こども が さわいで いた。,Children were making a lot of noise in the train.
30,そう,,"so, that way",Adverb,私もそう思います。,わたし も そう おもいます。,That's what I think too.
31,もう,,"already, yet",Adverb,彼はもう帰りました。,かれ は もう かえりました。,He's already gone home.
32,学生,がくせい,student,Noun,彼は真面目な学生です。,かれ は まじめな がくせい です。,He's a serious student.
33,熱い,あつい,hot (to touch),Adjective,このスープはとても熱い。,この スープ は とても あつい。,This soup is very hot.
34,どうぞ,,please,Adverb,こちらへどうぞ。,こちら へ どうぞ。,This way please.
35,午後,ごご,"afternoon, p.m.",Noun,明日の午後、お客様が来る。,あす の ごご おきゃくさま が くる。,A guest is coming to visit tomorrow afternoon.
36,長い,ながい,long,Adjective,彼女の髪はとても長い。,かのじょ の かみ は とても ながい。,Her hair is very long.
37,本,ほん,book,Noun,本を1冊買いました。,ほん を 1 さつ かいました。,I bought one book.
38,今年,ことし,this year (colloquial),Noun,今年はイタリアに旅行したい。,ことし は イタリア に りょこう したい。,I want to travel to Italy this year.
39,よく,,"often, well",Adverb,彼女はよく旅行に行きます。,かのじょ は よく りょこう に いきます。,She often goes on holiday.
40,彼女,かのじょ,"she, girlfriend",Pronoun,彼女はOLです。,かのじょ は オーエル です。,She's an office worker.
41,どう,,"how, what",Interrogative,あなたはどう思いますか。,あなた は どう おもいます か。,What do you think?
42,言葉,ことば,"word, language",Noun,この言葉の意味が分かりません。,この ことば の いみ が わかりません。,I don't understand the meaning of this word.
43,顔,かお,face,Noun,彼はタオルで顔を拭きました。,かれ は タオル で かお を ふきました。,He wiped his face with a towel.
44,終わる,おわる,"finish, end",Verb,会議は4時に終わります。,かいぎ は 4 じ に おわります。,The conference ends at four o'clock.
45,一つ,ひとつ,one (thing),Noun,それを一つください。,それ を ひとつ ください。,Please give me one of those.
46,あげる,,"give, offer (colloquial)",Verb,この本、あなたにあげます。,この ほん、あなた に あげます。,I'll give you this book.
47,こう,,"like this, such",Adverb,こう小さい字は読めない。,こう ちいさい じ は よめない。,I can't read such small letters.
48,学校,がっこう,school,Noun,学校は8時半に始まります。,がっこう は 8 じ はん に はじまります。,School starts at 8:30.
49,くれる,,be given,Verb,友達が誕生日プレゼントをくれた。,ともだち が たんじょうび プレゼント を くれた。,My friend gave me a birthday present.
50,始める,はじめる,start (something),Verb,テストを始めてください。,テスト を はじめて ください。,Please start the test.
51,起きる,おきる,"get up, get out of bed",Verb,私は毎朝6時に起きます。,わたし は まいあさ 6 じ に おきます。,I get up at six o'clock every morning.
52,春,はる,spring,Noun,今年の春は暖かいね。,ことし の はる は あたたかい ね。,"It's warm this spring, don't you think?"
53,午前,ごぜん,"morning, a.m.",Noun,午前9時のニュースです。,ごぜん 9 じ の ニュース です。,Now for the 9.00 a.m. news.
54,別,べつ,"another, different",Adjectival Noun,別の本も見せてください。,べつ の ほん も みせて ください。,Please show me another book.
55,どこ,,where,Interrogative,あの本をどこに置きましたか。,あの ほん を どこ に おきました か。,Where did you put that book?
56,部屋,へや,room,Noun,私の部屋は2階にあります。,わたし の へや は 2 かい に あります。,My room is on the second floor.
57,若い,わかい,young,Adjective,彼はまだ若いです。,かれ は まだ わかい です。,He's still young.
58,車,くるま,"car, automobile",Noun,弟が車を買った。,おとうと が くるま を かった。,My younger brother bought a car.
59,置く,おく,"put, place",Verb,彼はかばんをいすの上に置きました。,かれ は かばん を いす の うえ に おきました。,He put the bag on the chair.
60,住む,すむ,"live, reside",Verb,彼は会社の近くに住んでいる。,かれ は かいしゃ の ちかく に すんで いる。,He lives near his office.
61,働く,はたらく,work,Verb,姉は銀行で働いています。,あね は ぎんこう で はたらいて います。,My big sister works at a bank.
62,難しい,むずかしい,difficult,Adjective,この本は難しいですね。,この ほん は むずかしい です ね。,This book is difficult.
63,先生,せんせい,teacher (colloquial),Noun,私は日本語の先生になりたいです。,わたし は にほん ご の せんせい に なりたい です。,I want to become a Japanese teacher.
64,立つ,たつ,"stand, rise",Verb,彼はステージに立った。,かれ は ステージ に たった。,He stood on stage.
65,呼ぶ,よぶ,"call, name",Verb,ウェイターを呼びましょう。,ウェイター を よびましょう。,Let's call the waiter.
66,大学,だいがく,"university, college",Noun,大学に行ってもっと勉強したいです。,だいがく に いって もっと べんきょう したい です。,I want to go to college and study more.
67,安い,やすい,"cheap, inexpensive",Adjective,この服はとても安かった。,この ふく は とても やすかった。,These clothes were very cheap.
68,もっと,,more,Adverb,もっと近くに来てください。,もっと ちかく に きて ください。,Please come closer.
69,帰る,かえる,go back home,Verb,家に帰ろう。,うち に かえろう。,Let's go home.
70,分かる,わかる,understand,Verb,質問の意味は分かりましたか。,しつもん の いみ は わかりました か。,Did you understand the meaning of the question?
71,広い,ひろい,"wide, big",Adjective,彼の家はとても広い。,かれ の いえ は とても ひろい。,His house is very big.
72,数,かず,number,Noun,グラスの数が足りません。,グラス の かず が たりません。,We don't have enough number of glasses.
73,近い,ちかい,"near, close",Adjective,駅はここから近いです。,えき は ここ から ちかい です。,The station is near here.
74,そこ,,there,Pronoun,そこに座ってください。,そこ に すわって ください。,Please sit there.
75,走る,はしる,run,Verb,彼は毎晩3キロ走っています。,かれ は まいばん 3 キロ はしって います。,Every night he runs three kilometers.
76,入れる,いれる,put in,Verb,彼はかばんに手帳を入れた。,かれ は かばん に てちょう を いれた。,He put the notebook in his bag.
77,教える,おしえる,"teach, tell",Verb,彼は数学を教えています。,かれ は すうがく を おしえて います。,He teaches mathematics.
78,歩く,あるく,"walk, go on foot",Verb,駅まで歩きましょう。,えき まで あるきましょう。,Let's walk to the station.
79,会う,あう,meet,Verb,また会いましょう。,また あいましょう。,Let's meet again.
80,書く,かく,write,Verb,彼に手紙を書きました。,かれ に てがみ を かきました。,I wrote him a letter.
81,頭,あたま,head,Noun,今朝から頭が痛い。,けさ から あたま が いたい。,I've had a headache since this morning.
82,売る,うる,sell,Verb,彼は家を売った。,かれ は いえ を うった。,He sold the house.
83,大好き,だいすき,like (something) a lot,Adjectival Noun,私は犬が大好きだ。,わたし は いぬ が だいすき だ。,I like dogs a lot.
84,体,からだ,"body, physique, physical condition",Noun,私は体が丈夫だ。,わたし は からだ が じょうぶ だ。,I'm physically strong.
85,直ぐ,すぐ,"at once, soon",Adverb,直ぐ行きます。,すぐ いきます。,I'll go right away.
86,飛ぶ,とぶ,fly,Verb,鳥が飛んでいます。,とり が とんで います。,There's a bird flying.
87,とても,,very (colloquial),Adverb,この本はとてもおもしろい。,この ほん は とても おもしろい。,This book is very interesting.
88,誰,だれ,who,Interrogative,誰と会ってみたいですか。,だれ と あって みたい です か。,Who would you like to meet?
89,好き,すき,"favorite, liked",Adjectival Noun,私はワインが好きです。,わたし は ワイン が すき です。,I like wine.
90,読む,よむ,read,Verb,彼女は雑誌を読んでいます。,かのじょ は ざっし を よんで います。,She's reading a magazine.
91,次,つぎ,next,Noun,次はいつ会いましょうか。,つぎ は いつ あいましょう か。,When shall we meet again?
92,あなた,,you,Pronoun,これはあなたの鞄ですか。,これ は あなた の かばん です か。,Is this your bag?
93,飲む,のむ,drink,Verb,友達とお酒を飲んでいます。,ともだち と おさけ を のんで います。,I'm drinking sake with my friend.
94,古い,ふるい,old,Adjective,私は古い車が好きです。,わたし は ふるい くるま が すき です。,I like old cars.
95,質問,しつもん,question,Verbal Noun,質問のある方はどうぞ。,しつもん の ある かた は どうぞ。,Please feel free to ask any questions.
96,今日,きょう,today (colloquial),Noun,今日は仕事がありません。,きょう は しごと が ありません。,I don't have work today.
97,友達,ともだち,"friend, companion (colloquial)",Noun,私には友達がたくさんいます。,わたし に は ともだち が たくさん います。,I have a lot of friends.
98,早い,はやい,early,Adjective,まだ学校へ行くには早い時間です。,まだ がっこう へ いく に は はやい じかん です。,It's still too early to go to school.
99,どれ,,"what, which",Interrogative,この中でどれが好きですか。,この なか で どれ が すき です か。,Which of these do you like?
100,美しい,うつくしい,beautiful,Adjective,この絵は美しいです。,この え は うつくしい です。,This picture is beautiful.
101,いつも,,always (colloquial),Adverb,彼女はいつも元気だ。,かのじょ は いつも げんき だ。,She's always full of energy.
102,足,あし,"leg, foot",Noun,彼は足が長い。,かれ は あし が ながい。,He has long legs.
103,起こす,おこす,wake (someone) up,Verb,明日、6時に起こしてください。,あす 6 じ に おこして ください。,Please wake me up tomorrow at six o'clock.
104,見せる,みせる,show,Verb,その写真を見せてください。,その しゃしん を みせて ください。,Please show me those pictures.
105,娘,むすめ,"daughter, girl",Noun,私の娘はアメリカにいます。,わたし の むすめ は アメリカ に います。,My daughter is in the United States.
106,楽しむ,たのしむ,enjoy,Verb,今日は一人の時間を楽しみたい。,きょう は ひとり の じかん を たのしみたい。,Today I want to enjoy some time to myself.
107,色,いろ,color,Noun,すてきな色のセーターですね。,すてきな いろ の セーター です ね。,I like the color of your sweater.
108,みんな,,everybody (colloquial),Noun,みんなにお菓子をあげましょう。,みんな に おかし を あげましょう。,Let's give everyone some sweets.
109,取る,とる,"take, get",Verb,テストでいい点を取った。,テスト で いい てん を とった。,I got a good score on the test.
110,勉強,べんきょう,study,Verbal Noun,私は日本語を勉強しています。,わたし は にほん ご を べんきょう して います。,I'm studying Japanese.
111,できる,,"can do, be good at",Verb,彼女はイタリア語ができます。,かのじょ は イタリア ご が できます。,She can speak Italian.
112,短い,みじかい,"short, brief",Adjective,彼は足が短い。,かれ は あし が みじかい。,His legs are short.
113,落ちる,おちる,"fall, come down",Verb,猿も木から落ちる。,さる も き から おちる。,Even monkeys fall from trees.
114,息子,むすこ,son,Noun,うちの息子は大学1年生です。,うち の むすこ は だいがく 1 ねんせい です。,My son's a college freshman.
115,白い,しろい,"white, blank",Adjective,彼は歯が白い。,かれ は は が しろい。,His teeth are white.
116,飛行機,ひこうき,airplane,Noun,息子は飛行機のおもちゃが好きです。,むすこ は ひこうき の おもちゃ が すき です。,My son likes toy airplanes.
117,病気,びょうき,illness,Noun,祖父が病気になった。,そふ が びょうき に なった。,My grandfather got sick.
118,冬,ふゆ,winter,Noun,カナダの冬はとても寒いです。,カナダ の ふゆ は とても さむい です。,Canadian winters are very cold.
119,年,とし,"year, age",Noun,新しい年が始まりました。,あたらしい とし が はじまりました。,A new year has started.
120,重い,おもい,heavy,Adjective,このかばんは重いです。,この かばん は おもい です。,This bag is heavy.
121,胸,むね,"chest, breast",Noun,胸に少し痛みがあります。,むね に すこし いたみ が あります。,I have a slight pain in my chest.
122,払う,はらう,"pay (money, respect, attention, etc.)",Verb,私が払いましょう。,わたし が はらいましょう。,I'll pay for that.
123,軽い,かるい,"light (of weight, degree, etc.)",Adjective,この靴はとても軽い。,この くつ は とても かるい。,These shoes are very light.
124,見つける,みつける,find,Verb,新しい仕事を見つけました。,あたらしい しごと を みつけました。,I found a new job.
125,忘れる,わすれる,"forget, leave behind",Verb,約束を忘れないでください。,やくそく を わすれないで ください。,Please don't forget our promise.
126,酒,さけ,"alcohol, rice wine",Noun,彼女は酒に強い。,かのじょ は さけ に つよい。,She holds her liquor well.
127,どちら,,which (polite),Interrogative,肉と魚とどちらが好きですか。,にく と さかな と どちら が すき です か。,"Which do you prefer, meat or fish?"
128,姉,あね,(one's own) older sister,Noun,姉は大学生です。,あね は だいがくせい です。,My big sister's a college student.
129,覚える,おぼえる,"memorize, learn",Verb,妹は平仮名を全部覚えました。,いもうと は ひらがな を ぜんぶ おぼえました。,My little sister learned all hiragana.
130,狭い,せまい,"narrow, small",Adjective,私の部屋は狭いです。,わたし の へや は せまい です。,My room is small.
131,赤い,あかい,red,Adjective,赤いバラを買いました。,あかい バラ を かいました。,I bought a red rose.
132,着る,きる,"wear, put on",Verb,今日はスーツを着ています。,きょう は スーツ を きて います。,I'm wearing a suit today.
133,笑う,わらう,"laugh, smile",Verb,赤ん坊が笑っています。,あかんぼう が わらって います。,The baby is smiling.
134,一番,いちばん,"most, best",Adverb,彼はクラスで一番背が高い。,かれ は クラス で いちばん せ が たかい。,He's the tallest in class.
135,授業,じゅぎょう,"class session, lecture",Verbal Noun,今日は日本語の授業があります。,きょう は にほんご の じゅぎょう が あります。,We have a Japanese class today.
136,週,しゅう,week,Noun,その次の週は空いてますか。,その つぎ の しゅう は あいて ます か。,Will you be available the following week?
137,漢字,かんじ,Chinese character,Noun,漢字は中国からきました。,かんじ は ちゅうごく から きました 。,Kanji came from China.
138,自転車,じてんしゃ,bicycle,Noun,毎日、駅まで自転車で行きます。,まいにち、えき まで じてんしゃ で いきます。,I go to the station by bike every day.
139,電車,でんしゃ,train,Noun,私は電車で通学しています。,わたし は でんしゃ で つうがく して います。,I go to school by train.
140,探す,さがす,"search for, look for (someone or something one wants)",Verb,彼は郵便局を探していました。,かれ は ゆうびんきょく を さがして いました。,He was looking for the post office.
141,紙,かみ,paper,Noun,紙と鉛筆はありますか。,かみ と えんぴつ は あります か。,Do you have paper and pencil?
142,歌う,うたう,sing,Verb,私たちは大きな声で歌いました。,わたし たち は おおきな こえ で うたいました。,We sang loudly.
143,遅い,おそい,"slow, late",Adjective,前の車はとても遅い。,まえ の くるま は とても おそい。,The car in front of me is very slow.
144,首,くび,neck,Noun,きりんの首は長い。,きりん の くび は ながい。,Giraffes have long necks.
145,速い,はやい,fast,Adjective,彼は走るのが速い。,かれ は はしる の が はやい。,He runs fast.
146,一緒に,いっしょに,"together, at the same time",Adverb,一緒に帰りましょう。,いっしょ に かえりましょう。,Let's go home together.
147,今月,こんげつ,this month,Noun,今月はとても忙しい。,こんげつ は とても いそがしい。,I'm very busy this month.
148,遊ぶ,あそぶ,play,Verb,子供たちが公園で遊んでいる。,こども たち が こうえん で あそんで いる。,Kids are playing in the park.
149,遠い,とおい,"far, distant",Adjective,家から学校までは遠いです。,いえ から がっこう まで は とおい です。,It's a long way from my house to school.
150,弱い,よわい,weak,Adjective,その子は体が少し弱い。,その こ は からだ が すこし よわい。,That child has a somewhat weak constitution.
151,耳,みみ,ear,Noun,彼女は耳がよく聞こえません。,かのじょ は みみ が よく きこえません。,Her hearing isn't very good.
152,座る,すわる,"sit, sit down",Verb,私は窓側の席に座った。,わたし は まどがわ の せき に すわった。,I sat in a window seat.
153,右,みぎ,right,Noun,右のポケットにハンカチが入っています。,みぎ の ポケット に ハンカチ が はいって います。,I have a handkerchief in my right pocket.
154,浴びる,あびる,"take (a shower), bask",Verb,私は朝、シャワーを浴びます。,わたし は あさ、シャワー を あびます。,I take a shower in the morning.
155,肩,かた,shoulder,Noun,肩が凝りました。,かた が こりました。,My shoulders are stiff.
156,寝る,ねる,"sleep, go to sleep",Verb,もう寝よう。,もう ねよう。,Let's go to bed.
157,消す,けす,"switch off, turn off",Verb,昼間は電気を消してください。,ひるま は でんき を けして ください。,Please turn the lights off during the day.
158,元気,げんき,"healthy, energetic",Adjectival Noun,おかげさまで元気です。,おかげさま で げんき です。,"I'm fine, thank you."
159,全部,ぜんぶ,"all, whole",Noun,それ、全部ください。,それ ぜんぶ ください。,I'll take them all.
160,去年,きょねん,last year (colloquial),Noun,私は去年フランスへ行った。,わたし は きょねん フランス へ いった。,I went to France last year.
161,引く,ひく,"draw, pull",Verb,このドアは引いてください。,この ドア は ひいて ください。,Please pull this door open.
162,図書館,としょかん,library,Noun,図書館で料理の本を借りた。,としょかん で りょうり の ほん を かりた。,I borrowed a cookbook from the library.
163,上げる,あげる,"raise, lift",Verb,彼は荷物をあみだなに上げた。,かれ は にもつ を あみだな に あげた。,He put the luggage on the rack.
164,緑,みどり,"green color, greenery",Noun,この町には緑がたくさんあります。,この まち に は みどり が たくさん あります。,There's a lot of greenery in this town.
165,腕,うで,arm,Noun,彼の腕は太い。,かれ の うで は ふとい。,He has big arms.
166,ドア,,door (loan word),Noun,ドアを開けてください。,ドア を あけて ください。,Please open the door.
167,女の子,おんなのこ,little girl,Noun,あの女の子を知っていますか。,あの おんなのこ を しって います か。,Do you know that little girl?
