,word,pronounciation,definition,part of speech,sentence_1_kanji,sentence_1_hiragana,sentence_1_english
3148,喜び,よろこび,"joy, delight",Noun,人々は喜びに沸いた。,ひとびと は よろこび に わいた。,People exploded with joy.
3149,石油,せきゆ,petroleum oil,Noun,日本は石油のほとんどを輸入しています。,にっぽん は せきゆ の ほとんど を ゆにゅう して います。,Japan imports most of its oil.
3150,調子,ちょうし,"tone, condition",Noun,体の調子がとても良いです。,からだ の ちょうし が とても いい です。,I'm in good physical condition.
3151,単語,たんご,word,Noun,日本語の単語をいくつ知っていますか。,にほん ご の たんご を いくつ しって います か。,How many Japanese words do you know?
3152,表情,ひょうじょう,facial expression,Noun,彼はとても表情が豊かですね。,かれ は とても ひょうじょう が ゆたか です ね。,He's very expressive.
3153,基地,きち,"base, military base",Noun,ここは昔、軍事基地でした。,ここ は むかし、ぐんじ きち でした。,There used to be a military base here.
3154,駐車,ちゅうしゃ,parking,Verbal Noun,車はここに駐車してください。,くるま は ここ に ちゅうしゃ して ください。,Please park your car here.
3155,景気,けいき,economic conditions,Noun,景気が回復してきたね。,けいき が かいふく して きた ね。,The economy is recovering.
3156,比較的,ひかくてき,"comparatively, relatively",Adverb,今年は比較的景気がいい。,ことし は ひかくてき けいき が いい。,Business is comparatively good this year.
3157,植物,しょくぶつ,"plant, vegetation",Noun,休日は植物の世話をして過ごします。,きゅうじつ は しょくぶつ の せわ を して すごします。,I spend my days off taking care of my plants.
3158,世間,せけん,"world, the public",Noun,世間の反応は冷たかったよ。,せけん の はんのう は つめたかった よ。,The reaction from the public was cold.
3159,戦い,たたかい,"battle, fight",Noun,長い戦いが終わった。,ながい たたかい が おわった。,The long battle came to an end.
3160,限界,げんかい,"limit, limitation",Noun,もう我慢の限界です。,もう がまん の げんかい です。,This is the limit to my patience.
3161,抜く,ぬく,pull (something) out,Verb,ワインのコルクを抜きました。,ワイン の コルク を ぬきました。,I uncorked the wine.
3162,反映,はんえい,reflection,Verbal Noun,新型車に研究の成果が反映されています。,しんがた しゃ に けんきゅう の せいか が はんえい されて います。,The results of our research are reflected in the new model.
3163,最低,さいてい,"lowest, worst",Noun,これは今までで最低の記録だ。,これ は いま まで で さいてい の きろく だ。,This is the worst record so far.
3164,狙う,ねらう,"aim, be after",Verb,来年は優勝を狙います。,らいねん は ゆうしょう を ねらいます。,We will aim for a championship victory next year.
3165,微妙,びみょう,"subtle, delicate",Adjectival Noun,彼は会社で微妙な立場にあります。,かれ は かいしゃ で びみょうな たちば に あります。,He's in a delicate position in the company.
3166,結ぶ,むすぶ,"tie, join",Verb,彼女は髪にリボンを結んだね。,かのじょ は かみ に リボン を むすんだ ね。,She tied a ribbon in her hair.
3167,青年,せいねん,young man,Noun,町の青年たちはボランティア活動をしています。,まち の せいねん たち は ボランティア かつどう を して います。,Young people in the town are doing volunteer work.
3168,劇場,げきじょう,theater,Noun,午後8時に劇場の前で会いましょう。,ごご 8 じ に げきじょう の まえ で あいましょう。,Let's meet in front of the theater at 8:00 pm.
3169,要するに,ようするに,"in a word, in short",Adverb,要するに時機を待つべきだ。,ようする に じき を まつ べき だ。,"In short, we should wait for the right opportunity."
3170,真剣,しんけん,"serious, attentive",Adjectival Noun,彼は真剣に話を聞いていました。,かれ は しんけん に はなし を きいて いました。,He was listening attentively to the story.
3171,講義,こうぎ,lecture,Verbal Noun,彼の講義はとても分かりやすいですね。,かれ の こうぎ は とても わかりやすい です ね。,His lectures are very easy to understand.
3172,貴重,きちょう,"precious, valuable",Adjectival Noun,彼は貴重な体験をしたわね。,かれ は きちょうな たいけん を した わ ね。,He had a valuable experience.
3173,工夫,くふう,"scheme, devise, trick",Verbal Noun,いろいろ工夫して仕事をやりとげたさ。,いろいろ くふう して しごと を やりとげた さ。,I made various adjustments and carried out the work.
3174,幅,はば,"width, breadth",Noun,この道は幅が狭いので気をつけて運転してください。,この みち は はば が せまい ので きをつけて うんてん して ください。,"The width of this road is narrow, so please drive carefully."
3175,必ずしも,かならずしも,"not always, not necessarily",Adverb,親切は必ずしも喜ばれるわけではない。,しんせつ は かならずしも よろこばれる わけ で は ない。,People don't necessarily appreciate kindness at all times.
3176,券,けん,"voucher, ticket",Noun,入場券をお持ちですか。,にゅうじょう けん を おもち です か。,Do you have an admission ticket?
3177,意外,いがい,"unexpected, surprising",Adjectival Noun,意外にも彼は独身です。,いがい に も かれ は どくしん です。,"Surprisingly, he is single."
3178,重視,じゅうし,"importance, value",Verbal Noun,あの企業では学歴が重視されるよ。,あの きぎょう で は がくれき が じゅうし される よ。,That company values one's educational background.
3179,医学,いがく,"medical science, medicine",Noun,彼は医学を学んでいます。,かれ は いがく を まなんで います。,He studies medicine.
3180,プラス,,"plus, advantage",Verbal Noun,この経験はあなたにとってプラスになるでしょう。,この けいけん は あなた にとって プラス に なる でしょう。,This experience will be a good thing for you.
3181,刺激,しげき,stimulus,Verbal Noun,そのクイズ番組は脳を刺激するね。,その クイズ ばんぐみ は のう を しげき する ね。,The quiz show stimulates the brain.
3182,中間,ちゅうかん,"middle, between",Noun,そのふたつの町の中間には川が流れているの。,その ふたつ の まち の ちゅうかん に は かわ が ながれて いる の。,There's a river flowing between the two towns.
3183,柔道,じゅうどう,judo,Noun,私は柔道を習っています。,わたし は じゅうどう を ならって います。,I'm learning judo.
3184,削る,けずる,"scrape, cut back",Verb,彼は家族のために仕事の時間を削った。,かれ は かぞく の ため に しごと の じかん を けずった。,He reduced his working hours for his family.
3185,上昇,じょうしょう,"rise, upturn",Verbal Noun,地球の気温は上昇している。,ちきゅう の きおん は じょうしょう して いる。,The temperature of the earth is rising.
3186,攻撃,こうげき,"attack, assault",Verbal Noun,2003年にアメリカはイラクを攻撃した。,2003 ねん に アメリカ は イラク を こうげき した。,The United States attacked Iraq in 2003.
3187,候補,こうほ,candidate,Noun,会長の候補は3人います。,かいちょう の こうほ は 3 にん います。,There are three candidates for chairperson.
3188,主張,しゅちょう,"claim, assertion",Verbal Noun,上司は私の主張を受け入れた。,じょうし は わたし の しゅちょう を うけいれた。,My boss accepted my claim.
3189,条件,じょうけん,"condition, term",Noun,この条件では厳しすぎます。,この じょうけん で は きびし すぎます。,These terms are too strict.
3190,援助,えんじょ,"aid, assistance",Verbal Noun,その国には物資の援助が必要です。,その くに に は ぶっし の えんじょ が ひつよう です。,The country needs material aid.
3191,作者,さくしゃ,"writer, creator of an artwork",Noun,この本の作者は誰ですか。,この ほん の さくしゃ は だれ です か。,Who is the writer of this book?
3192,賛成,さんせい,"approval, agreement",Verbal Noun,私は彼の意見に賛成だ。,わたし は かれ の いけん に さんせい だ。,I agree with his opinion.
3193,法則,ほうそく,"law, principle",Noun,勝利するには法則があるそうだ。,しょうり する に は ほうそく が ある そうだ。,I hear that there are principles to follow in order to win.
3194,科目,かもく,school subject,Noun,今日は3科目のテストを受けたよ。,きょう は 3 かもく の テスト を うけた よ。,I took exams for three subjects today.
3195,務める,つとめる,"perform a duty, play a role",Verb,私が司会を務めます。,わたし が しかい を つとめます。,I'll be the host.
3196,鉄道,てつどう,railway,Noun,日本は鉄道がとても発達しています。,にっぽん は てつどう が とても はったつ して います。,The railway system in Japan is well developed.
3197,従う,したがう,"follow, obey",Verb,上司の指示に従った。,じょうし の しじ に したがった。,I followed the instructions from my boss.
3198,叫ぶ,さけぶ,"shout, cry out",Verb,彼女は助けを求めて大声で叫んだの。,かのじょ は たすけ を もとめて おおごえ で さけんだ の。,She cried out for help.
3199,組む,くむ,"pair up, partner with",Verb,このプロジェクトで私は彼と組んでいるんだ。,この プロジェクト で わたし は かれ と くんで いる ん だ。,I'm pairing up with him for this project.
3200,印刷,いんさつ,printing,Verbal Noun,年賀状を印刷したの。,ねんがじょう を いんさつ した の。,I printed New Year's cards.
3201,一致,いっち,"agreement, match",Verbal Noun,皆の意見が一致しました。,みんな の いけん が いっち しました。,We all came to an agreement.
3202,筆者,ひっしゃ,"writer, author",Noun,筆者の趣旨を考えてください。,ひっしゃ の しゅし を かんがえて ください。,Please consider the author's point.
3203,模様,もよう,"pattern, design",Noun,彼女は水玉模様のスカートをはいているね。,かのじょ は みずたま もよう の スカート を はいて いる ね。,She's wearing a skirt with polka dots.
3204,速度,そくど,"speed, velocity",Noun,新幹線の速度はどれくらいですか。,しんかんせん の そくど は どれ くらい です か。,How fast is the speed of the Shinkansen?
3205,外部,がいぶ,"outside, outer",Noun,これは外部には秘密です。,これ は がいぶ に は ひみつ です。,This is confidential.
3206,重ねる,かさねる,"put (something) on top of another, pile up",Verb,荷物はここに重ねてください。,にもつ は ここ に かさねて ください。,Please pile up the luggage here.
3207,抵抗,ていこう,resistance,Verbal Noun,犯人は警察に抵抗したの。,はんにん は けいさつ に ていこう した の。,The criminal resisted the police.
3208,定期,ていき,"regular, periodic (thing)",Noun,定期演奏会は年に4回あります。,ていき えんそう かい は ねん に 4 かい あります。,We have our regular concerts four times a year.
3209,混乱,こんらん,"chaos, confusion",Verbal Noun,地震のあと、町は大混乱だったよ。,じしん の あと、まち は だい こんらん だった よ。,"After the earthquake, the town was in great chaos."
3210,自殺,じさつ,suicide,Verbal Noun,犯人は警察に捕まる前に自殺しました。,はんにん は けいさつ に つかまる まえ に じさつ しました。,The criminal committed suicide before he was caught by the police.
3211,幸い,さいわい,"fortunately, thankfully",Adjectival Noun,幸い、電車に嵐の影響はなかった。,さいわい、でんしゃ に あらし の えいきょう は なかった。,"Fortunately, the train was not affected by the storm."
3212,神様,かみさま,god (polite),Noun,神様にお願いしました。,かみさま に おねがい しました。,I asked a favor from the gods in my prayers.
3213,参る,まいる,"go, come (humble)",Verb,さあ、参りましょうか。,さあ、まいりましょう か。,"Well, shall we go?"
3214,城,しろ,castle,Noun,今回の旅行ではヨーロッパの城を見て回ります。,こんかい の りょこう で は ヨーロッパ の しろ を みて まわります。,I will look around some European castles on this trip.
3215,シーズン,,"season (loan word), time period when something is commonly done",Noun,その選手は今シーズンも好調だね。,その せんしゅ は こん シーズン も こうちょう だ ね。,The player is in good condition this season as well.
3216,筋,すじ,"muscle, nerve",Noun,転んで筋を痛めてしまいました。,ころんで すじ を いためて しまいました。,I fell down and hurt my tendon.
3217,たとえ,,"even if, granting that",Adverb,たとえ、嵐になっても絶対に行く。,たとえ、あらし に なって も ぜったい に いく。,"Even if the storm comes, I'll go for sure."
3218,天皇,てんのう,emperor,Noun,日本には天皇がいます。,にっぽん に は てんのう が います。,Japan has an emperor.
3219,ともかく,,"at any rate, in any case",Adverb,ともかく一度考え直しましょう。,ともかく いちど かんがえ なおしましょう。,"At any rate, let's think about this once again."
3220,題,だい,"title, topic",Noun,その曲の題を思い出せません。,その きょく の だい を おもいだせません。,I can't remember the title of the piece.
3221,運,うん,"fortune, luck",Noun,彼は運のいい男です。,かれ は うん の いい おとこ です。,He is a lucky man.
3222,不満,ふまん,"dissatisfaction, discontent",Noun,私は彼のやり方には不満です。,わたし は かれ の やりかた に は ふまん です。,I'm dissatisfied with his way of doing things.
3223,原理,げんり,"mechanism, theory",Noun,見学者に機械の動く原理を説明しました。,けんがく しゃ に きかい の うごく げんり を せつめい しました。,I explained the mechanism of the machine to the visitor.
3224,楽器,がっき,musical instrument,Noun,私が好きな楽器はギターです。,わたし が すきな がっき は ギター です。,My favorite instrument is the guitar.
3225,詩,し,"poetry, poem",Noun,彼女の詩は世界中で有名になったんだ。,かのじょ の し は せかい じゅう で ゆうめい に なった ん だ。,Her poem became famous all over the world.
3226,容易,ようい,"easy, simple (formal)",Adjectival Noun,彼はその問題を容易に解決したわ。,かれ は その もんだい を ようい に かいけつした わ。,He easily solved the problem.
3227,滞在,たいざい,stay,Verbal Noun,日本では北海道に滞在しました。,にっぽん で は ほっかいどう に たいざい しました。,I stayed in Hokkaido when I went to Japan.
3228,各地,かくち,"every place, various parts",Noun,各地で大雨が降っています。,かくち で おおあめ が ふって います。,Heavy rain is falling in various regions.
3229,済む,すむ,"be settled, complete",Verb,父の手術が無事に済みました。,ちち の しゅじゅつ が ぶじ に すみました。,My father's operation was completed without trouble.
3230,香り,かおり,fragrance,Noun,この花はいい香りがしますね。,この はな は いい かおり が します ね。,This flower smells good.
3231,老人,ろうじん,"old person, elderly",Noun,子供が老人の手を引いて歩いていたの。,こども が ろうじん の て を ひいて あるいて いた の。,A child was holding an old person's hand as they walked.
3232,一瞬,いっしゅん,"instant, moment",Noun,一瞬自分の耳を疑ったよ。,いっしゅん じぶん の みみ を うたがった よ。,For a moment I couldn't believe what I heard.
3233,当日,とうじつ,the day (of the event etc.),Noun,入場券は当日でも買えますよ。,にゅうじょう けん は とうじつ でも かえます よ。,You can buy admission tickets on the same day.
3234,割合,わりあい,"rate, proportion",Noun,二つの薬品を1対3の割合で混ぜたんだ。,ふたつ の やくひん を 1 たい 3 の わりあい で まぜた ん だ。,I mixed the two chemicals at a ratio of 1 to 3.
3235,正式,せいしき,"formal, proper",Adjectival Noun,正式な招待状を受け取りました。,せいしきな しょうたい じょう を うけとりました。,I received a formal invitation.
3236,出場,しゅつじょう,"participation (in a sports competition, etc.)",Verbal Noun,今日は8チームが出場しました。,きょう は 8 チーム が しゅつじょう しました。,Eight teams participated today.
3237,寄せる,よせる,draw (something) near,Verb,車を塀に寄せたよ。,くるま を へい に よせた よ。,I pulled my car over by the wall.
3238,板,いた,"board, plank",Noun,父は長い板を買ってきたんだ。,ちち は ながい いた を かって きた ん だ。,My father bought a long plank.
3239,張る,はる,"strain, be stretched",Verb,疲れて肩が張っています。,つかれて かた が はって います。,My shoulders are stiff with fatigue.
3240,実績,じっせき,"results achieved, performance",Noun,彼は営業で実績を上げたんだ。,かれ は えいぎょう で じっせき を あげた ん だ。,He achieved good results working in sales.
3241,頼る,たよる,"rely on, depend on",Verb,人に頼らないで、自分でやってごらん。,ひと に たよらない で 、 じぶん で やって ごらん。,Do it yourself without relying on other people.
3242,申し訳,もうしわけ,"excuse, apology",Noun,申し訳ございません。,もうしわけ ございません。,I'm truly sorry.
3243,ふと,,"suddenly, unintentionally",Adverb,ふと昔の事を思い出したんだ。,ふと むかし の こと を おもいだした ん だ。,I suddenly remembered the past.
3244,回転,かいてん,"spin, rotation",Verbal Noun,彼はボールに回転をかけたんだ。,かれ は ボール に かいてん を かけた ん だ。,He put a spin on the ball.
3245,ステージ,,stage (for a performance),Noun,彼はステージに立ったよ。,かれ は ステージ に たった よ。,He stood on the stage.
3246,広げる,ひろげる,spread (something),Verb,電車の中では新聞を広げないで。,でんしゃ の なか で は しんぶん を ひろげない で。,Don't spread your newspaper wide open in the train.
3247,通す,とおす,pass (someone/something) through,Verb,針に糸を通してください。,はり に いと を とおして ください。,Please thread the needle.
3248,知事,ちじ,governor,Noun,彼は有能な知事ね。,かれ は ゆうのうな ちじ ね。,He's a capable governor.
3249,勝負,しょうぶ,"victory or defeat, game",Verbal Noun,勝負はまだ始まったばかりよ。,しょうぶ は まだ はじまった ばかり よ。,The game has just started.
3250,やがて,,"soon, before long",Adverb,やがて雪も止むでしょう。,やがて ゆき も やむ でしょう。,The snow will stop before long.
3251,直後,ちょくご,immediately after,Noun,食べた直後に寝ないほうがいいよ。,たべた ちょくご に ねない ほう が いい よ。,You should not sleep immediately after meals.
3252,奪う,うばう,"rob, take by force",Verb,その男は彼女のバッグを奪ったぞ。,その おとこ は かのじょ の バッグ を うばった ぞ。,The man stole her bag.
3253,救う,すくう,"save, relieve",Verb,彼女は通りがかりの人に救われたよ。,かのじょ は とおりがかり の ひと に すくわれた よ。,She was saved by a passing stranger.
3254,測定,そくてい,measure,Verbal Noun,これから身長と体重を測定します。,これから しんちょう と たいじゅう を そくてい します。,Now we will measure your height and weight.
3255,道具,どうぐ,tool,Noun,道具は全部そろっていますか。,どうぐ は ぜんぶ そろって います か。,Do we have all the tools ready?
3256,刑事,けいじ,detective,Noun,刑事が現場を調べているわ。,けいじ が げんば を しらべて いる わ。,The detective is investigating the crime scene.
3257,症状,しょうじょう,symptom,Noun,医者に症状を説明したよ。,いしゃ に しょうじょう を せつめい した よ。,I explained my symptoms to the doctor.
3258,勢い,いきおい,"vigor, momentum",Noun,そのチームには勢いがありますね。,その チーム に は いきおい が あります ね。,That team has momentum.
3259,表面,ひょうめん,surface,Noun,月の表面にはクレーターがたくさんあるね。,つき の ひょうめん に は クレーター が たくさん ある ね。,There are a lot of craters on the surface of the moon.
3260,列,れつ,"row, line",Noun,店の前に長い列ができていたね。,みせ の まえ に ながい れつ が できて いた ね。,There was a long line in front of the shop.
3261,腹,はら,belly (often used by men),Noun,笑い過ぎて腹が痛い。,わらいすぎて はら が いたい。,I laughed so much that my belly hurts.
3262,玉,たま,"bead, ball",Noun,彼の顔に玉のような汗が流れていたの。,かれ の かお に たま の ような あせ が ながれて いた の。,Beads of sweat were rolling down his face.
3263,学会,がっかい,"academic association, academic conference",Noun,彼は学会で論文を発表したよ。,かれ は がっかい で ろんぶん を はっぴょう した よ。,He presented his paper at the academic conference.
3264,承認,しょうにん,"approval, recognition",Verbal Noun,これは政府の承認を受けた資格です。,これ は せいふ の しょうにん を うけた しかく です。,This is a qualification approved by the government
3265,プラン,,plan (loan word),Noun,彼女と旅行のプランを考えました。,かのじょ と りょこう の プラン を かんがえました。,I made a plan for a trip with my girlfriend.
3266,書店,しょてん,bookstore (formal),Noun,駅前に新しい書店ができました。,えき まえ に あたらしい しょてん が できました。,There's a new bookstore in front of the station.
3267,祈る,いのる,"pray, wish for",Verb,みんなが人質の無事を祈っているわよ。,みんな が ひとじち の ぶじ を いのって いる わ よ。,Everyone is praying for the safety of the hostage.
3268,意志,いし,"will, volition",Noun,彼は意志の強い人です。,かれ は いし の つよい ひと です。,He is a strong-willed man.
3269,暮らし,くらし,"living, livelihood",Noun,彼女は毎日の暮らしを楽しんでいますね。,かのじょ は まいにち の くらし を たのしんで います ね。,She's enjoying her daily life.
3270,勇気,ゆうき,courage,Noun,彼は勇気があるね。,かれ は ゆうき が ある ね。,He's courageous.
3271,売買,ばいばい,buying and selling,Verbal Noun,彼は不動産の売買をしています。,かれ は ふどうさん の ばいばい を して います。,He buys and sells real estate.
3272,生まれ,うまれ,"birth, origin",Noun,彼女は京都の生まれです。,かのじょ は きょうと の うまれ です。,She was born in Kyoto.
3273,確率,かくりつ,"probability, chance",Noun,天気予報は当たる確率が高くなりましたね。,てんき よほう は あたる かくりつ が たかく なりました ね。,The weather forecast is getting a higher probability of proving its forecast right.
3274,予防,よぼう,"prevention, protection",Verbal Noun,虫歯は予防できます。,むしば は よぼう できます。,Cavities can be prevented.
3275,爆発,ばくはつ,"explosion, eruption",Verbal Noun,ダイナマイトが爆発したんだ。,ダイナマイト が ばくはつ した ん だ。,The dynamite exploded.
3276,マッチ,,"match, matchbox",Noun,マッチを持っていますか。,マッチ を もって います か。,Do you have a match?
3277,資金,しきん,"funds, capital",Noun,私たちは今、結婚資金を貯めています。,わたし たち は いま、けっこん しきん を ためて います。,We're saving money for the wedding now.
3278,投資,とうし,investment,Verbal Noun,私は4つの会社に投資しています。,わたし は よっつ の かいしゃ に とうし して います。,I'm investing in four companies.
