,word,pronounciation,definition,part of speech,sentence_1_kanji,sentence_1_hiragana,sentence_1_english
1689,主人,しゅじん,"one's husband, master",Noun,主人は今、留守です。,しゅじん は いま、るす です。,My husband is out now.
1690,お宅,おたく,(someone else's) home,Noun,先生のお宅はどちらですか。,せんせい の おたく は どちら です か。,Which is the teacher's house?
1691,ハイキング,,hiking,Verbal Noun,昨日は友人とハイキングに行きました。,きのう は ゆうじん と ハイキング に いきました。,I went hiking with my friend yesterday.
1692,畑,はたけ,"field, farm",Noun,母は畑仕事が好きだ。,はは は はたけ しごと が すき だ。,My mother likes working in the field.
1693,ボーイフレンド,,boyfriend,Noun,私のボーイフレンドはハンサムでした。,わたし の ボーイフレンド は ハンサム でした。,My boyfriend was handsome.
1694,イヤリング,,earrings,Noun,彼女はすてきなイヤリングをしている。,かのじょ は すてきな イヤリング を して いる。,She's wearing beautiful earrings.
1695,ガールフレンド,,girlfriend,Noun,昔は彼女のことをガールフレンドと言っていました。,むかし は かのじょ の こと を ガールフレンド と いって いました。,"We used to call our girlfriends ""garufurendo."""
1696,柔らか,やわらか,"soft, gentle",Adjectival Noun,彼の声は柔らかだ。,かれ の こえ は やわらか だ。,His voice is soft.
1697,納豆,なっとう,fermented soybeans,Noun,私は納豆をよく食べます。,わたし は なっとう を よく たべます。,I often eat natto.
1698,別に,べつに,"particularly, not really",Adverb,私は別に気になりません。,わたし は べつ に き に なりません。,I don't really care about it.
1699,どうしても,,"by any means, no matter how",Adverb,どうしてもその訳を知りたい。,どうして も その わけ を しりたい。,"By any means, I want to know the reason."
1700,父親,ちちおや,"father, male parent",Noun,彼の父親は先生です。,かれ の ちちおや は せんせい です。,His father is a teacher.
1701,誘う,さそう,"invite, ask out",Verb,彼女をデートに誘った。,かのじょ を デート に さそった。,I asked her out on a date.
1702,母親,ははおや,"mother, female parent",Noun,彼女は2才の子の母親です。,かのじょ は 2 さい の こ の ははおや です。,She's a mother of a two-year-old kid.
1703,昼前,ひるまえ,"in the morning, before noon",Noun,昼前に会議があった。,ひる まえ に かいぎ が あった。,There was a meeting in the morning.
1704,ふらふら,,"be dizzy, lightheaded",Adverb,私は疲れてふらふらです。,わたし は つかれて ふらふら です。,I'm tired and feel dizzy.
1705,こぼす,,spill (something),Verb,ソファにワインをこぼした。,ソファ に ワイン を こぼした。,I spilt wine on the sofa.
1706,持ってくる,もってくる,bring,Verb,そのいすを持ってきてください。,その いす を もって きて ください。,Please bring the chair.
1707,振り向く,ふりむく,"turn around, look back",Verb,彼女は振り向いて俺に微笑んだんだ。,かのじょ は ふりむいて おれ に ほほえんだ ん だ。,She turned around and smiled at me.
1708,洗面所,せんめんじょ,"washroom, bathroom",Noun,洗面所で顔を洗った。,せんめんじょ で かお を あらった。,She washed her face in the washroom.
1709,外側,そとがわ,"exterior, outside",Noun,白線の外側を歩かないでください。,はくせん の そと がわ を あるかないで ください。,Please don't walk outside the white line.
1710,段々,だんだん,"gradually, little by little",Adverb,段々仕事が楽しくなってきました。,だんだん しごと が たのしく なって きました。,Little by little I've come to enjoy my work.
1711,包む,つつむ,"wrap, pack",Verb,プレゼントをきれいな紙で包みました。,プレゼント を きれいな かみ で つつみました。,I wrapped the present in beautiful paper.
1712,無くなる,なくなる,"go missing, run out",Verb,もうお金が無くなりました。,もう おかね が なくなりました。,I've run out of money already.
1713,豚,ぶた,pig,Noun,豚はすごく鼻がいい。,ぶた は すごく はな が いい。,Pigs have a very keen sense of smell.
1714,褒める,ほめる,"praise, compliment",Verb,頑張ったので褒められました。,がんばった ので ほめられました。,He was praised because he worked hard.
1715,沸かす,わかす,boil (water),Verb,お湯を沸かしてください。,おゆ を わかして ください。,Please boil some water.
1716,暖める,あたためる,warm (something) up,Verb,今、車を暖めています。,いま、くるま を あたためて います。,I'm warming up the car now.
1717,換える,かえる,"exchange, convert",Verb,車のタイヤを換えた。,くるま の タイヤ を かえた。,I changed the tires on the car.
1718,安っぽい,やすっぽい,"cheap-looking, tacky",Adjective,そのシャツは安っぽいね。,その シャツ は やすっぽい ね。,That shirt looks cheap.
1719,ぎらぎら,,"glaring, blinding",Adverb,太陽がぎらぎらしている。,たいよう が ぎらぎら して いる。,The sun is glaring.
1720,何とか,なんとか,somehow or other,Adverb,何とかお願いします。,なんとか おねがい します。,"Please, I'm begging you."
1721,いよいよ,,"finally, any moment",Adverb,明日はいよいよ出発の日です。,あした は いよいよ しゅっぱつ の ひ です。,We'll finally leave here tomorrow.
1722,がらがら,,not crowded,Adjectival Noun,映画館はがらがらでした。,えいがかん は がらがら でした。,The movie theater was not crowded at all.
1723,缶詰,かんづめ,canned food,Noun,缶詰のフルーツはとても甘い。,かんづめ の フルーツ は とても あまい。,Canned fruit is very sweet.
1724,怪我,けが,injury,Verbal Noun,彼女は腕を怪我した。,かのじょ は うで を けが した。,She injured her arm.
1725,寒さ,さむさ,"coldness, cold",Noun,今日は厳しい寒さになるでしょう。,きょう は きびしい さむさ に なる でしょう。,It will be very cold today.
1726,祝日,しゅくじつ,holiday,Noun,五月三日は祝日だ。,ご がつ みっか は しゅくじつ だ。,May 3rd is a holiday.
1727,すき焼き,すきやき,sukiyaki,Noun,昨日の夜はすき焼きを食べた。,きのう の よる は すきやき を たべた。,I had sukiyaki last night.
1728,葉書,はがき,postcard,Noun,家族に葉書を書いています。,かぞく に はがき を かいて います。,I'm writing a postcard to my family.
1729,掃く,はく,sweep,Verb,床をほうきで掃きました。,ゆか を ほうき で はきました。,I swept the floor with a broom.
1730,何しろ,なにしろ,"anyhow, as you may know",Adverb,彼は何しろよくしゃべります。,かれ は なにしろ よく しゃべります。,"As you may know, he talks a lot."
1731,どんどん,,"quickly, rapidly",Adverb,彼は山道をどんどん進んでいったの。,かれ は やまみち を どんどん すすんで いった の 。,He made quick progress along the mountain path.
1732,ぺこぺこ,,"hungry, starving",Adjectival Noun,私はおなかがぺこぺこです。,わたし は おなか が ぺこぺこ です。,I'm very hungry.
1733,ぺらぺら,,"fluently, in a chatty way",Adjectival Noun,彼女はドイツ語がぺらぺらです。,かのじょ は ドイツ ご が ぺらぺら です。,She speaks German fluently.
1734,レインコート,,raincoat,Noun,雨なのでレインコートを着ました。,あめ なので レインコート を きました。,I put on my raincoat because it was raining.
1735,アイス,,ice cream (for short),Noun,暑いのでアイスを食べました。,あつい ので アイス を たべました。,I ate ice cream because it was hot.
1736,塩辛い,しおからい,salty,Adjective,海の水は塩辛い。,うみ の みず は しおからい。,Sea water is salty.
1737,セロテープ,,scotch tape,Noun,セロテープはありますか。,セロテープ は あります か。,Do you have any scotch tape?
1738,大幅,おおはば,"drastically, substantially",Adjectival Noun,計画を大幅に変更した。,けいかく を おおはば に へんこう した。,We made a substantial change to the plan.
1739,教育,きょういく,education,Verbal Noun,彼は海外で教育を受けました。,かれ は かいがい で きょういく を うけました。,He received his education abroad.
1740,工事,こうじ,"construction, repairing",Verbal Noun,工事の音がうるさい。,こうじ の おと が うるさい。,The construction site is noisy.
1741,担当,たんとう,being in charge (of official duties),Verbal Noun,私はセールスを担当しています。,わたし は セールス を たんとう して います。,I'm in charge of sales.
1742,法律,ほうりつ,law,Noun,新しい法律ができた。,あたらしい ほうりつ が できた。,A new law has been passed.
1743,丸,まる,"circle, round",Noun,紙に大きな丸を描きました。,かみ に おおきな まる を かきました。,I drew a big circle on the paper.
1744,発表,はっぴょう,announcement,Verbal Noun,合格者が発表された。,ごうかくしゃ が はっぴょう された。,They announced the names of those who passed (the test).
1745,研究,けんきゅう,"research, study",Verbal Noun,彼は何年も地震の研究をしている。,かれ は なんねん も じしん の けんきゅう を して いる。,He's been researching earthquakes for many years.
1746,一方,いっぽう,"one way, the other party",Adverb,ここは一方通行です。,ここ は いっぽうつうこう です。,This is a one-way street.
1747,国内,こくない,"domestic, internal",Noun,この携帯電話が使えるのは国内だけです。,この けいたい でんわ が つかえる の は こくない だけ です。,You can only make domestic calls on this cell-phone.
1748,全体,ぜんたい,"whole, total",Noun,全体の80パーセントが完成しました。,ぜんたい の 80 パーセント が かんせい しました。,80 percent of the total has been completed.
1749,後,のち,"after, afterward (formal)",Noun,後に彼は総理大臣になりました。,のち に かれ は そうりだいじん に なりました。,He would later become Prime Minister.
1750,人間,にんげん,human being,Noun,人間の心は複雑です。,にんげん の こころ は ふくざつ です。,The human mind is complex.
1751,刺身,さしみ,sliced raw fish or meat,Noun,私は刺身は食べません。,わたし は さしみ は たべません。,I don't eat sashimi.
1752,ばら,,rose,Noun,お祝いにばらの花束を贈りました。,おいわい に ばら の はなたば を おくりました。,I gave her a bouquet of roses for a celebration.
1753,ねずみ,,"rat, mouse",Noun,台所にねずみが出た。,だいどころ に ねずみ が でた。,A mouse came out in the kitchen.
1754,以下,いか,below,Noun,数学が平均点以下だった。,すうがく が へいきん てん いか だった。,My math score was below average.
1755,昔,むかし,"old times, the old days",Noun,昔のことを思い出したの。,むかし の こと を おもいだした の。,I remembered the past.
1756,訳,わけ,"reason, sense",Noun,そんな訳で、私は仕事を辞めました。,そんな わけ で、わたし は しごと を やめました。,I quit my job for that reason.
1757,違い,ちがい,"difference, mistake",Noun,この二つには大きな違いがある。,この ふたつ に は おおきな ちがい が ある。,There's a big difference between these two.
1758,しっかり,,"mature, responsible",Adverb,彼は若いのにしっかりしてるね。,かれ は わかい のに しっかり してる ね。,He is responsible even though he is young.
1759,将来,しょうらい,"future, in the future",Noun,将来はパイロットになりたいです。,しょうらい は パイロット に なりたい です。,I want to become a pilot in the future.
1760,不思議,ふしぎ,"mystery, wonder",Adjectival Noun,それはとても不思議な話だね。,それ は とても ふしぎな はなし だ ね。,It's a very mysterious story.
1761,決して,けっして,"never, by no means",Adverb,このことを決して忘れないでください。,この こと を けっして わすれないで ください。,Don't you ever forget this.
1762,失敗,しっぱい,"failure, mistake",Verbal Noun,一度の失敗であきらめてはいけないよ。,いちど の しっぱい で あきらめて は いけない よ。,You shouldn't give up just because you've failed once.
1763,番,ばん,"one's turn, watch",Noun,今日は私が皿を洗う番ですね。,きょう は わたし が さら を あらう ばん です ね。,It's my turn to do the dishes today.
1764,出会う,であう,"meet, encounter",Verb,アメリカで彼女と出会いました。,アメリカ で かのじょ と であいました。,I met her in the United States.
1765,悩む,なやむ,"be troubled, suffer",Verb,彼は受験のことで悩んでいます。,かれ は じゅけん の こと で なやんで います。,He's worried about entrance examinations.
1766,汗,あせ,sweat,Noun,彼は額に汗をかいていたの。,かれ は ひたい に あせ を かいて いた の。,He was sweating from his forehead.
1767,すっかり,,"all, completely",Adverb,買い物をすっかり忘れていた。,かいもの を すっかり わすれて いた。,I completely forgot about the shopping.
1768,代わり,かわり,"substitution, alternative",Noun,ごま油の代わりにオリーブ油を使いましょう。,ごまあぶら の かわり に オリーブゆ を つかいましょう。,Let's use olive oil instead of sesame.
1769,一言,ひとこと,"single word, brief speech",Noun,社長に一言お願いしたの。,しゃちょう に ひとこと おねがい した の。,I asked the president to deliver a brief speech.
1770,豊か,ゆたか,"rich, ample",Adjectival Noun,彼は心が豊かな人です。,かれ は こころ が ゆたかな ひと です。,He has a rich spirit.
1771,接続,せつぞく,"connection, joining",Verbal Noun,コンピューターをネットワークに接続しました。,コンピューター を ネットワーク に せつぞく しました。,The computer has been connected with the network.
1772,抱える,かかえる,hold in one's arms,Verb,彼は大きな荷物を抱えているわ。,かれ は おおきな にもつ を かかえて いる わ。,He is carrying some large luggage.
1773,エンジン,,engine,Noun,車のエンジンが調子悪い。,くるま の エンジン が ちょうし わるい。,The car engine is in a bad condition.
1774,少女,しょうじょ,young girl,Noun,それは少女向けの雑誌です。,それ は しょうじょ むけ の ざっし です。,It's a magazine for young girls.
1775,無駄,むだ,"pointless, waste",Adjectival Noun,それは時間の無駄です。,それ は じかん の むだ です。,It's a waste of time.
1776,自動,じどう,automatic operation,Noun,このドアは自動よ。,この ドア は じどう よ。,This door is automatic.
1777,先輩,せんぱい,"senior, superior",Noun,日本人は先輩、後輩の関係をとても大切に考えます。,にっぽん じん は せんぱい、こうはい の かんけい を とても たいせつ に かんがえます。,Japanese people value the relationship between seniors and juniors.
1778,眺める,ながめる,"look out, gaze",Verb,猫が窓から外を眺めているよ。,ねこ が まど から そと を ながめて いる よ。,The cat is at the window looking outside.
1779,書類,しょるい,"documents, papers",Noun,書類を10枚コピー しました。,しょるい を 10 まい コピー しました。,I made ten copies of the document.
1780,年月,ねんげつ,"years, period of time",Noun,そのお寺は長い年月をかけて建てられた。,その おてら は ながい ねんげつ を かけて たてられた。,The temple was built over a long period of time.
1781,燃やす,もやす,burn (something),Verb,古い手紙を燃やしたんだ。,ふるい てがみ を もやした ん だ。,I burned some old letters.
1782,線路,せんろ,"railway track, line",Noun,子猫が線路に迷い込んだぞ。,こ ねこ が せんろ に まよいこんだ ぞ。,A kitten strayed onto the railway track.
1783,水着,みずぎ,"bathing suit, swimsuit",Noun,水着に着替えました。,みずぎ に きがえました。,I changed into a swimsuit.
1784,可愛らしい,かわいらしい,"lovely, charming",Adjective,彼女は娘に可愛らしい服を作りましたね。,かのじょ は むすめ に かわいらしい ふく を つくりました ね。,She made some lovely clothes for her daughter.
1785,仲良し,なかよし,good friend,Noun,あの3人組は仲良しですね。,あの 3 にん ぐみ は なかよし です ね。,Those three are good friends.
1786,梅干し,うめぼし,pickled plum,Noun,うちでは、朝食には必ず梅干しが出ます。,うち で は、 ちょうしょく に は かならず うめぼし が でます。,Pickled plums are always served for breakfast at my home.
1787,ドレス,,formal dress,Noun,彼女は紫のドレスを着ていた。,かのじょ は むらさき の ドレス を きて いた。,She wore a purple formal dress.
1788,尽くす,つくす,"make utmost efforts, devote to",Verb,彼女は夫に尽くしている。,かのじょ は おっと に つくして いる。,She is devoted to her husband.
1789,地球,ちきゅう,the earth,Noun,地球は丸い。,ちきゅう は まるい。,The earth is round.
1790,不親切,ふしんせつ,"unkind, inconsiderate",Adjectival Noun,その店員は不親切だった。,その てんいん は ふしんせつ だった。,That store clerk was unkind.
1791,からから,,"very thirsty, very dry",Adjectival Noun,おしゃべりして喉がからからになりました。,おしゃべり して のど が からから に なりました。,My throat got dry from chatting.
1792,本箱,ほんばこ,bookcase,Noun,雑誌を本箱に入れました。,ざっし を ほんばこ に いれました。,I put the magazine in the bookcase.
1793,横書き,よこがき,horizontal writing,Noun,この本は横書きです。,この ほん は よこがき です。,This book is printed horizontally.
1794,そば屋,そばや,buckwheat noodle shop,Noun,昼はそば屋に行きました。,ひる は そば や に いきました。,I went to a noodle shop for lunch.
1795,加工,かこう,"processing, editing (a photo, etc.)",Verbal Noun,この工場では魚を加工している。,この こうじょう で は さかな を かこう して いる。,This factory processes fish.
1796,実験,じっけん,experiment,Verbal Noun,科学の授業で実験をした。,かがく の じゅぎょう で じっけん を した。,We did an experiment in science class.
1797,愛する,あいする,"love, care for",Verb,私は家族を愛しています。,わたし は かぞく を あいして います。,I love my family.
1798,あんまり,,"(not) that much, (not) so much",Adverb,これはあんまり好きじゃないな。,これ は あんまり すき じゃ ない な。,I don't like this very much.
1799,いきなり,,"all of a sudden, abruptly",Adverb,後ろからいきなり肩をたたかれた。,うしろ から いきなり かた を たたかれた。,Someone tapped on my shoulder from behind all of a sudden.
1800,表,おもて,"front, outside",Noun,表に人が来ています。,おもて に ひと が きて います。,There's someone at the front door.
1801,汚れ,よごれ,"dirt, blot",Noun,靴の汚れを落としました。,くつ の よごれ を おとしました。,I cleaned the dirt off the shoes.
1802,間,あいだ,"interval, space between things",Noun,雲の間から月が出た。,くも の あいだ から つき が でた。,The moon came out from between the clouds.
1803,紫,むらさき,purple,Noun,彼女は紫のドレスを着ていた。,かのじょ は むらさき の ドレス を きて いた。,She wore a purple dress.
1804,灰色,はいいろ,"ash color, gray",Noun,今日の空は灰色だ。,きょう の そら は はいいろ だ。,The sky's gray today.
1805,血,ち,blood (colloquial),Noun,血が出ていますよ。,ち が でて います よ。,You're bleeding.
1806,顎,あご,"jaw, chin",Noun,顎が痛い。,あご が いたい。,My jaw hurts.
1807,始めに,はじめに,in the beginning,Adverb,始めにスープが出ます。,はじめ に スープ が でます。,Soup will be served in the beginning.
1808,暖まる,あたたまる,"get warm (air, atmosphere, etc.)",Verb,まだ部屋が暖まらない。,まだ へや が あたたまらない。,The room hasn't warmed up yet.
1809,お世辞,おせじ,"compliment, flattery",Noun,彼はお世辞を言うのが上手い。,かれ は おせじ を いう の が うまい。,He is good at flattering people.
1810,袋,ふくろ,"bag, sack",Noun,袋は要りません。,ふくろ は いりません。,I don't need a bag.
1811,長袖,ながそで,long sleeves,Noun,今日は寒いので長袖を着ました。,きょう は さむい ので ながそで を きました。,I put on a long-sleeved shirt because it's cold today.
1812,半袖,はんそで,short sleeves,Noun,今日は、半袖のシャツを着よう。,きょう は、はんそで の シャツ を きよう。,I'll put on a short-sleeved shirt today.
1813,形,かたち,"shape, form",Noun,その椅子は変わった形をしている。,その いす は かわった かたち を して いる。,That chair has an unusual shape.
1814,景色,けしき,natural scenery or landscape,Noun,ここは景色が綺麗ですね。,ここ は けしき が きれい です ね。,The scenery here is beautiful.
1815,ざあざあ,,pouring,Adverb,雨がざあざあ降っている。,あめ が ざあざあ ふって いる。,It's pouring.
1816,再来月,さらいげつ,the month after next,Noun,再来月まで予約でいっぱいです。,さらいげつ まで よやく で いっぱい です。,We're fully booked until the month after the next.
1817,泊める,とめる,let (someone) stay over,Verb,友達をうちに泊めてあげました。,ともだち を うち に とめて あげました。,I let my friend stay over at my house.
1818,叱る,しかる,"scold, reprimand",Verb,父親が子供を叱っている。,ちちおや が こども を しかって いる。,The father is scolding his child.
1819,騒ぐ,さわぐ,"make a noise, make a racket",Verb,電車の中で騒がないでください。,でんしゃ の なか で さわがないで ください。,Please don't make a racket in the train.
1820,車道,しゃどう,"road, roadway (for cars)",Noun,車道の工事が始まりました。,しゃどう の こうじ が はじまりました。,The road construction has started.
1821,掃除機,そうじき,vacuum cleaner,Noun,掃除機が壊れた。,そうじき が こわれた。,The vacuum cleaner broke.
1822,剃る,そる,shave,Verb,父は毎日髭を剃ります。,ちち は まいにち ひげ を そります。,My father shaves every day.
1823,貼る,はる,"stick, paste, put",Verb,机にシールを貼った。,つくえ に シール を はった。,I put a sticker on the desk.
1824,台,だい,"stand, table",Noun,そこにちょうど良い台がある。,そこ に ちょうど いい だい が ある。,We have a perfect table there.
1825,主に,おもに,"mostly, predominantly",Adverb,この商品は主に女性に人気がありまして。,この しょうひん は おも に じょせい に にんき が ありまして。,This product is predominantly popular among women.
1826,倒す,たおす,"knock down, overthrow",Verb,そのスキーヤーはポールを倒した。,その スキーヤー は ポール を たおした。,The skier knocked the pole down.
1827,星,ほし,"star, planet",Noun,今夜は星がよく見えます。,こんや は ほし が よく みえます。,You can see the stars clearly tonight.
1828,長女,ちょうじょ,eldest daughter,Noun,うちの長女は10歳です。,うち の ちょうじょ は 10 さい です。,Our oldest daughter is ten.
1829,爪,つめ,"nail, claw",Noun,爪が伸びています。,つめ が のびて います。,My nails have grown.
1830,缶,かん,"can, tin",Noun,コーヒーはその缶に入っています。,コーヒー は その かん に はいって います。,The coffee is in that can.
1831,とんとん,,"tapping, patting",Adverb,母の肩をとんとんたたいた。,はは の かた を とんとん たたいた。,I gave my mother a massage by patting on her shoulders.
1832,袖,そで,sleeve,Noun,このシャツは袖が短い。,この シャツ は そで が みじかい。,This shirt has short sleeves.
1833,濡れる,ぬれる,get wet,Verb,雨で濡れてしまった。,あめ で ぬれて しまった。,I got wet in the rain.
